{
  "schema_version": 1,
  "proof_kind": "local-coordination-historical-project-record-write-proof",
  "module_key": "{{GOVERNANCE_MODULE_KEY}}",
  "maintainer_title": "{{GOVERNANCE_MAINTAINER_TITLE}}",
  "agent_id": "{{AGGREGATION_AGENT_ID}}",
  "run_id": "{{AGGREGATION_RUN_ID}}",
  "lease_id": "{{CLOSED_RECEIPT_LEASE_ID}}",
  "target_path": "{{AGGREGATION_RECEIPT_PATH}}",
  "owned_paths": ["{{GOVERNANCE_OWNED_PATH}}"],
  "lease_path": "{{CLOSED_RECEIPT_LEASE_PATH}}",
  "lease_sha256": "{{CLOSED_RECEIPT_LEASE_SHA256}}",
  "registry_snapshot_path": "{{RECEIPT_REGISTRY_SNAPSHOT_PATH}}",
  "registry_snapshot_sha256": "{{RECEIPT_REGISTRY_SNAPSHOT_SHA256}}",
  "agents_snapshot_path": "{{RECEIPT_AGENTS_SNAPSHOT_PATH}}",
  "agents_snapshot_sha256": "{{RECEIPT_AGENTS_SNAPSHOT_SHA256}}",
  "writer_evidence_path": "{{WRITER_EVIDENCE_PATH}}",
  "writer_evidence_sha256": "{{WRITER_EVIDENCE_SHA256}}",
  "writer_source_path": "{{WRITER_SOURCE_SNAPSHOT_PATH}}",
  "writer_source_sha256": "{{WRITER_SOURCE_SNAPSHOT_SHA256}}",
  "baseline_sha256": "{{BASELINE_SHA256}}",
  "code_version": "{{CODE_VERSION}}",
  "build_id": "{{BUILD_ID}}",
  "candidate_sha256": "{{CANDIDATE_SHA256}}"
}
